,ACR scenario,Guideline,Variant,Appropriateness Category,MRI scan ordered,Clinical File,queries,Table_1,Table_2,Table_3,Table_4,Table_5,avg_table,Text_1,Text_2,Text_3,Text_4,Text_5,avg_text,avg_overall
34,Symptomatic patient with a primary shoulder arthroplasty. Initial imaging.,ACR imaging after shoulder arthroplasty.pdf,2,UNA,MRI shoulder without IV contrast,"66 year old Indian female.  Post left total shoulder replacement 1 year ago for avascular necrosis and secondary osteoarthritis.  Past medical history of hypertension, colonic polyps post polypectomy.  Now coming with worsening left shoulder pain and stiffness over 6 months. On examination, limited range of motion of left shoulder due to pain.  No recent imaging.  MRI shoulder without IV contrast for further assessment. ","Patient Profile: The patient is a 66-year-old female who had a left total shoulder replacement 1 year ago due to avascular necrosis and secondary osteoarthritis. She has a past medical history of hypertension and colonic polyps post polypectomy. She is currently experiencing worsening left shoulder pain and stiffness over the past 6 months, with limited range of motion due to pain. There has been no recent imaging.
Scan ordered:   MRI shoulder without IV contrast for further assessment",0.7604898791970859,0.7521564283116587,0.7484001068299991,0.7459492544265613,0.7405260136100857,0.7495043364750782,0.7541443468823568,0.7453392402534083,0.7442628953373946,0.7421067937434932,0.7373510585400759,0.7446408669513458,0.747072601713212
35,"Symptomatic patient with a primary shoulder arthroplasty, infection excluded. Suspected loosening. Additional imaging following radiographs.",ACR imaging after shoulder arthroplasty.pdf,4,UA,MRI shoulder without IV contrast,"60 year old Chinese male.  Post right total shoulder replacement 2 years ago for osteoarthritis.  Smoker.  Past medical history of chronic obstructive pulmonary disease, left upper lobectomy for lung cancer.  Now complaining of right shoulder pain for past 2 months.  No night pain. No fever.  On examination, pain on range of motion testing. No swelling or erythema or discharging sinus.   Total white blood cell count, CRP and ESR are not elevated.    X-rays show equivocal loosening of implant, but otherwise no fracture or gross destructive bone lesion.  MRI shoulder without IV contrast to further assess.  ","Patient Profile: The patient is a 60-year-old male who had a right total shoulder replacement 2 years ago due to osteoarthritis. He is currently experiencing right shoulder pain for the past 2 months. He has a past medical history of chronic obstructive pulmonary disease and lung cancer. His X-rays show equivocal loosening of the implant, but no fracture or gross destructive bone lesion.
Scan ordered:   MRI shoulder without IV contrast to further assess",0.7769699693816042,0.7740550573915708,0.7678972837412796,0.7657081983089594,0.7583956777140489,0.7686052373074926,0.7701361659781141,0.764164052639492,0.7640902461125569,0.756109599519267,0.7512630089252229,0.7611526146349307,0.7648789259712117
36,Symptomatic patient with hip prosthesis. Initial imaging.,ACR imaging after total hip arthroplasty.pdf,2,UNA,MRI hip without IV contrast,"58 year old Indonesian female.  Post left total hip replacement for severe osteoarthritis 6 months ago.  Past medical history of diabetes, hypertension, hyperlipidemia, appendicectomy.  Now presenting with left hip pain, difficulty walking.  No fever.  No night pain.  On examination, pain in left hip on assessing range of motion.  No tenderness.  MRI left hip without IV contrast as initial imaging for this presentation, to assess for cause of left hip pain post total hip replacement.","Patient Profile: The patient is a 58-year-old female who had a left total hip replacement for severe osteoarthritis 6 months ago. She has a past medical history of diabetes, hypertension, and hyperlipidemia. She is currently presenting with left hip pain and difficulty walking. There is pain in her left hip when assessing range of motion.
Scan ordered:   MRI left hip without IV contrast as initial imaging for this presentation, to assess for cause of left hip pain post total hip replacement",0.7621070810379308,0.7582881783377154,0.7490815606165714,0.746451903229866,0.7455040333179774,0.7522865513080121,0.7490516912048246,0.7467261660287755,0.746166727729613,0.7414049488902873,0.7342646526546502,0.7435228373016302,0.7479046943048211
37,"Symptomatic hip arthroplasty patient, history of acute injury. Additional imaging following radiographs.",ACR imaging after total hip arthroplasty.pdf,3,MBA,MRI hip without IV contrast,"80 year old Caucasian male.  Post right total hip replacement for severe osteoarthritis 3 years ago.  History of hypertension on medications.  Now presenting with 2 day history of right hip pain post fall.  On examination, no obvious hip or limb deformity.  Range of motion assessment is limited by pain.  X-rays show no periprosthetic fracture or loosening.  For MRI right hip without IV contrast for further assessment.","Patient Profile: The patient is an 80-year-old Caucasian male who had a right total hip replacement for severe osteoarthritis 3 years ago. He has a history of hypertension and is on medications. He is now presenting with a 2-day history of right hip pain after a fall. His range of motion assessment is limited by pain. X-rays show no periprosthetic fracture or loosening.
Scan ordered:   For MRI right hip without IV contrast for further assessment",0.7916797816102863,0.7735911822865268,0.7668573941942898,0.7633789312794438,0.7618237750121702,0.7714662128765433,0.7634509715065637,0.7580377943749297,0.751191097670896,0.7466591172130574,0.7458318394197834,0.753034164037046,0.7622501884567947
38,"Symptomatic hip arthroplasty patient, infection not excluded. Additional imaging following radiographs.",ACR imaging after total hip arthroplasty.pdf,4,UA,MRI hip without IV contrast,"67 year old Malay male.  Post left hip bipolar hemiarthroplasty post neck of femur fracture.  Past medical history of poorly controlled diabetes, end stage renal failure on peritoneal dialysis, prior intestinal obstruction post small bowel resection due to adhesions, ischemic heart disease on optimal medical treatment.  Now presenting 1 month post left hip hemiarthroplasty with hip pain and fever for 1 week.  On examination, no obvious discharging skin sinus.  Limited range of motion due to pain.  X-rays show no obvious periprosthetic fracture or loosening, no destructive bone lesion or soft tissue gas.  Total white blood cell count and CRP are elevated.  For MRI of the left hip without IV contrast to assess for implant infection.  ","Patient Profile: The patient is a 67-year-old male with a history of left hip bipolar hemiarthroplasty post neck of femur fracture. He has a past medical history of poorly controlled diabetes, end stage renal failure on peritoneal dialysis, prior intestinal obstruction post small bowel resection due to adhesions, and ischemic heart disease on optimal medical treatment. He is currently presenting with hip pain and fever for 1 week, 1 month post left hip hemiarthroplasty. His examination shows no obvious discharging skin sinus and limited range of motion due to pain. X-rays show no obvious periprosthetic fracture or loosening, no destructive bone lesion or soft tissue gas. His total white blood cell count and CRP are elevated.
Scan ordered:   For MRI of the left hip without IV contrast to assess for implant infection",0.7755729535662732,0.7743359224441955,0.7661724507739957,0.7654264465904297,0.7470683510655896,0.7657152248880967,0.7687513734336687,0.7602751646596024,0.7565321591130553,0.7531824132338902,0.7489523806263322,0.7575386982133099,0.7616269615507033
39,"Hip arthroplasty patient with trochanteric pain. Suspect abductor injury, or trochanteric bursitis, or other soft tissue abnormality. Additional imaging following radiographs.",ACR imaging after total hip arthroplasty.pdf,7,UA,MRI hip without IV contrast,"64 year old Chinese female.  Post right hip bipolar hemiarthroplasty post neck of femur fracture.  Now presenting 3 months after operation due to right lateral hip pain.  Painful to sleep on right hip.  No fever.  On examination, tender over right greater trochanter.  Pain on forced abduction of right hip.  X-rays show no periprosthetic fracture or loosening, no obvious myositis ossificans.  For MRI right hip without IV contrast to assess for trochanteric bursitis.","Patient Profile: The patient is a 64-year-old female who has undergone right hip bipolar hemiarthroplasty following a neck of femur fracture. She is now experiencing right lateral hip pain three months post-operation, particularly when sleeping on her right hip. Physical examination reveals tenderness over the right greater trochanter and pain on forced abduction of the right hip. X-rays have ruled out periprosthetic fracture or loosening, and myositis ossificans.
Scan ordered:   For MRI right hip without IV contrast to assess for trochanteric bursitis",0.8054295465677542,0.760097812278555,0.7580954947171449,0.7414640332674639,0.738641971298646,0.7607457716259127,0.7787971390986239,0.774761438871381,0.7689284009256586,0.7439588370256861,0.7382190231990898,0.7609329678240879,0.7608393697250003
40,Pain after total knee arthroplasty. Suspect periprosthetic or hardware fracture. Additional imaging following radiographs.,ACR imaging after total knee arthroplasty.pdf,4,MBA,MRI knee without IV contrast,"65 year old Malay male.  Post left total knee replacement 4 years ago.  Past medical history of diabetes, hypertension, hyperlipidemia, end stage renal failure on hemodialysis, cataract post intra-ocular lens.  Now severe pain in left knee after slipping and falling 3 days ago. On examination, left knee swollen, limited range of motion due to pain.  No obvious deformity.  X-rays show no obvious periprosthetic fracture or loosening, but there is a large suprapatellar effusion.  MRI left knee without IV contrast to assess for radiographically occult periprosthetic fracture.","Patient Profile: The patient is a 65-year-old male who had a total knee replacement on his left knee 4 years ago. He has a past medical history of diabetes, hypertension, hyperlipidemia, end stage renal failure on hemodialysis, and cataract post intra-ocular lens. He is currently experiencing severe pain in his left knee after slipping and falling 3 days ago. His left knee is swollen and has a limited range of motion due to pain. X-rays show no obvious periprosthetic fracture or loosening, but there is a large suprapatellar effusion.
Scan ordered:   MRI left knee without IV contrast to assess for radiographically occult periprosthetic fracture",0.7628980416216841,0.760924316791028,0.7600143962112659,0.744351812823876,0.7326576240422643,0.7521692382980236,0.7474029103751065,0.7459039489833398,0.7456571293437817,0.7432039855819765,0.7333317259241806,0.7430999400416769,0.7476345891698503
41,Suspected infection after total knee arthroplasty. Additional imaging following radiographs.,ACR imaging after total knee arthroplasty.pdf,2,MBA,MRI knee without and with IV contrast,"74 year old Indian female.  Post right total knee replacement 1 year ago.  Now presenting with fever, right knee swelling and redness for 4 days.  On examination, right knee moderately swollen, erythematous, tender and warm.  No obvious discharge.  Limited range of motion due to pain.  X-rays show no obvious destructive bone lesion or soft tissue gas or periprosthetic loosening or fracture.  For MRI right knee without and with IV contrast to assess for implant infection. ","Patient Profile: The patient is a 74 year old female who had a right total knee replacement 1 year ago. She is now presenting with fever, right knee swelling and redness for 4 days. The right knee is moderately swollen, erythematous, tender and warm with no obvious discharge. There is a limited range of motion due to pain. X-rays show no obvious destructive bone lesion or soft tissue gas or periprosthetic loosening or fracture.
Scan ordered:   For MRI right knee without and with IV contrast to assess for implant infection",0.7491272510554369,0.7396317483069351,0.7363330010815857,0.7324593113961895,0.720184786243462,0.7355472196167219,0.7531378580803759,0.7505948711952654,0.7433782981129826,0.7361857790373748,0.7360369308754878,0.7438667474602974,0.7397069835385096
42,Malignant or aggressive primary bone tumor. Surveillance for local recurrence,ACR aggressive primary msk tumour staging and surveillance.pdf,4,UA,MRI area of interest without and with IV contrast,"11 year old Chinese male.  Left distal femur osteosarcoma post chemotherapy and limb salvage surgery 1 year ago.  Functionally independent, community ambulant without assistance. On examination, no obvious limb length discrepancy, no palpable mass at operative site, skin ok.  For MRI left knee and femur without and with IV contrast for surveillance.  ","Patient Profile: The patient is an 11-year-old male who had osteosarcoma in the left distal femur. He underwent chemotherapy and limb salvage surgery 1 year ago. He is functionally independent and can walk without assistance. There is no obvious limb length discrepancy or palpable mass at the operative site.
Scan ordered:   For MRI left knee and femur without and with IV contrast for surveillance",0.7182451743996179,0.7094883007165764,0.7076006400038158,0.7039879358970521,0.7035708141308693,0.7085785730295864,0.718310485165634,0.716182053655474,0.7133463626400204,0.706517286594361,0.7060571133981616,0.7120826602907302,0.7103306166601583
43,New symptomatic vertebral compression fracture (VCF) identified on radiographs. No known malignancy. Next imaging study.,ACR management of vertebral compression fracture.pdf,1,UNA,MRI spine area of interest without and with IV contrast,"80 year old Chinese female.  Background of hypertension, hyperlipidemia, right breast cancer post simple mastectomy and sentinel node biopsy 20 years ago.  Sedentary.  Now presenting with low back pain for 5 days, no inciting event recalled.  On examination, no obvious step deformity, mild tenderness at L1 region.  Mildly kyphotic.  X-rays show L1 moderate compression fracture, osteopenia, and mild lumbar spondylosis.  MRI lumbar spine without and with IV contrast to further assess compression fracture.","Patient Profile: The patient is an 80-year-old female with a history of hypertension, hyperlipidemia, and right breast cancer post simple mastectomy and sentinel node biopsy 20 years ago. She is currently presenting with low back pain for 5 days, with no inciting event recalled. On examination, there is mild tenderness at the L1 region and she is mildly kyphotic. X-rays show L1 moderate compression fracture, osteopenia, and mild lumbar spondylosis.
Scan ordered:   MRI lumbar spine without and with IV contrast to further assess compression fracture",0.7436951958256958,0.7411621007576704,0.7342892091096072,0.7331012421316871,0.7294927977691276,0.7363481091187576,0.7877499244433491,0.7740890357907095,0.7689866093930877,0.7542794802087711,0.7481674893255547,0.7666545078322944,0.751501308475526
44,Suspect primary bone tumor. Initial imaging.,ACR primary bone tumours.pdf,1,UNA,MRI area of interest without and with IV contrast,"13 year old Caucasian female.  No prior medical history.  Does 200 metre sprinting for school.  Now presenting with 3 month history of right knee pain, sometimes waking her up at night.  No fever.  No inciting trauma.  No loss of weight or appetitie.  On examination, mild swelling in right knee.  Otherwise unremarkable examination.  No prior imaging.  MRI right knee with and without IV contrast to assess for any malignancy. ","Patient Profile: The patient is a 13-year-old Caucasian female with no prior medical history. She is a sprinter for her school. She has been experiencing right knee pain for the past 3 months, which sometimes wakes her up at night. There is no history of trauma, fever, weight loss, or loss of appetite. On examination, there is mild swelling in her right knee. She has not had any prior imaging.
Scan ordered:   MRI right knee with and without IV contrast to assess for any malignancy",0.7528034082487656,0.7509311148864364,0.7468077988005289,0.7391643134432381,0.7341879793553096,0.7447789229468558,0.7611292602420051,0.7489814871503725,0.7429664511786381,0.7372619122714802,0.7277641886763715,0.7436206599037736,0.7441997914253147
45,Suspect primary bone tumor. Radiographs or clinical presentation suggest osteoid osteoma. Next imaging study.,ACR primary bone tumours.pdf,4,MBA,MRI area of interest without and with IV contrast,"17 year old Malay female.  No prior medical history.  Does Malay dance as co-curricular activity in school. Now presenting with 2 month history of right thigh dull pain, sometimes worse at night.  Affects her ability do dance.  Pain improves on naproxen.  No fever, no loss of weight or appetiite.  On examination: antalgic gait.  No gross mass palpated at right thigh.  Right hip and knee full range of motion.  No limb length discrepancy.  X-rays raise possiblity of osteoid osteoma at right femur shaft.  MRI right thigh without and with IV contrast to confirm finding of osteoid osteoma.","Patient Profile: The patient is a 17-year-old Malay female with no prior medical history. She is a dancer and is currently experiencing a 2-month history of right thigh dull pain, which sometimes worsens at night and affects her ability to dance. The pain improves with naproxen. She has no fever, no loss of weight or appetite. Upon examination, she has an antalgic gait but no gross mass palpated at the right thigh. Her right hip and knee have a full range of motion and there is no limb length discrepancy. X-rays suggest the possibility of an osteoid osteoma at the right femur shaft.
Scan ordered:   MRI right thigh without and with IV contrast to confirm finding of osteoid osteoma",0.7262938777990593,0.7204417366294857,0.7141591674569195,0.7135944601991315,0.7130156646507805,0.7175009813470754,0.7221647515358616,0.7149464558477463,0.7102570470063672,0.7055840552183563,0.7051241536306943,0.7116152926478051,0.7145581369974403
46,Traumatic shoulder pain. Any etiology. Initial imaging.,ACR shoulder pain traumatic.pdf,1,UNA,MRI shoulder without IV contrast,"31 year old Chinese male.  Special operations task force officer.  No past medical history.  Now presenting due to fall from 2nd storey during rappelling today, landing on right shoulder.  Severe pain and swelling.  On examination, bruising over right shoudler, swelling, inability to assess range of motion due to pain. No prior imaging.  MRI right shoulder without IV contrast to assess traumatic injury.  ","Patient Profile: The patient is a 31-year-old male with no past medical history. He fell from the second storey during rappelling today, landing on his right shoulder. He is experiencing severe pain and swelling in the right shoulder, with bruising and inability to assess range of motion due to pain. There is no prior imaging.
Scan ordered:   MRI right shoulder without IV contrast to assess traumatic injury",0.7675638954961728,0.7665464687905621,0.7580757354393943,0.7466746055455952,0.7460549981991509,0.756983140694175,0.7626675462601039,0.7588165995474387,0.7529100956112409,0.7497359503299825,0.7493774615977633,0.7547015306693059,0.7558423356817405
47,Traumatic shoulder pain. Radiographs show humeral head or neck fracture. Next imaging study.,ACR shoulder pain traumatic.pdf,3,UNA,MRI shoulder without IV contrast,"45 year old Indian male.  Professional weight lifter.  No past medical history.  Was doing benchpress when weight slipped out of hand and hit his right shoulder. Heard snapping sound, felt severe pain.  On examination, marked right shoulder swelling, tender, no redness.  Mild deformity.  X-rays show communited right humeral neck fracture.  No dislocation.  MRI right shoulder without IV contrast for further assessment.  ","Patient Profile: The patient is a 45-year-old male with no past medical history. He is a professional weight lifter who experienced an accident during benchpress where the weight slipped out of his hand and hit his right shoulder. He heard a snapping sound and felt severe pain. Physical examination revealed marked right shoulder swelling, tenderness, and mild deformity. X-rays show a comminuted right humeral neck fracture with no dislocation.
Scan ordered:   MRI right shoulder without IV contrast for further assessment",0.7708339334530142,0.7560457785545109,0.7511752474000022,0.7491295560282715,0.7469443024784364,0.754825763582847,0.7507618778679686,0.7504165853243608,0.7469226739823653,0.7428194862855843,0.7419582299293935,0.7465757706779346,0.7507007671303908
48,Nonsuperficial (deep) soft tissue mass. Initial imaging.,ACR soft tissue mass.pdf,2,UNA,MRI area of interest without and with IV contrast,"37 year old Chinese female.  Executive in company.  No prior medical history.  Now presents with lump over right thigh x 3 months.  Family history of gastric cancer.  Lump not painful, not growing. Worried that this may be cancer.  On examination, smooth, non tender, mobile subcutaneous lump at right thigh approximately 2cm in size.  For MRI right thigh without and with IV contrast to assess for lipoma.  ","Patient Profile: The patient is a 37-year-old female with a lump on her right thigh that has been present for 3 months. The lump is smooth, non-tender, mobile, and subcutaneous, measuring approximately 2cm in size. The patient has no prior medical history but has a family history of gastric cancer. She is worried that the lump may be cancerous.
Scan ordered:   For MRI right thigh without and with IV contrast to assess for lipoma",0.7055501980459035,0.6959619702732674,0.6912088636946034,0.6872823887781452,0.6619654402395294,0.6883937722062898,0.691910285075791,0.6861863048195996,0.6841302046440119,0.6804444576241071,0.6800118248120723,0.6845366153951163,0.6864651938007031
49,Soft tissue mass. Nondiagnostic radiograph and noncontrast-enhanced ultrasound. Next imaging study.,ACR soft tissue mass.pdf,3,MBA,MRI area of interest without IV contrast,"26 year old Caucasian male.  Works in technology company as quality assurance lead.  No prior medical history. Now presents with right foot lump x 2 months.  Increasing in size.  No fever, no loss of weight or appetitie.  No inciting traumatic event.  No pain, able to walk normally.  On examination, there is a 3cm lump over the dorsum of the mid-forefoot, non tender.  X-rays shows no destructive bone lesion, but the lump shows some calcifications.  Non contrast-enhanced ultrasound shows subcutaneous hypoechoic lesion with mildly irregular margins, and few foci of calcification.  For MRI of mid-forefoot without IV contrast for further assessment of lump, possibly soft tissue sarcoma.  ","Patient Profile: The patient is a 26-year-old Caucasian male with no prior medical history. He has been experiencing a right foot lump for 2 months, which has been increasing in size. There is no associated fever, weight loss, or loss of appetite. There was no inciting traumatic event and the patient experiences no pain and is able to walk normally. Examination reveals a 3cm lump over the dorsum of the mid-forefoot, which is non-tender. X-rays show no destructive bone lesion, but the lump shows some calcifications. A non-contrast-enhanced ultrasound shows a subcutaneous hypoechoic lesion with mildly irregular margins, and a few foci of calcification.
Scan ordered:   For MRI of mid-forefoot without IV contrast for further assessment of lump, possibly soft tissue sarcoma",0.7453729254811456,0.744387051874779,0.721223962897011,0.7170605087831925,0.7165114228810744,0.7289111743834404,0.7203688741006985,0.716111238134915,0.7123824976756368,0.7117519292965075,0.7106823408646049,0.7142593760144724,0.7215852751989564
50,"Suspected stress (fatigue) fracture, excluding vertebrae. First imaging study.",ACR stress fracture including sacrum.pdf,1,UNA,MRI area of interest without IV contrast,"18 year old Eurasian male.  Full time national service, in guards battalion.  No prior medical history.  Now presents with severe right foot pain after fast march.  Cannot walk without assistance.  On examination, mildly swollen right foot.  Tender on deep palpation of 2nd and 3rd metatarsals.  No prior imaging.  For MRI of mid and forefoot without IV contrast to assess for stress fracture.  ","Patient Profile: The patient is an 18-year-old male with no prior medical history. He is currently experiencing severe right foot pain after a fast march and cannot walk without assistance. His right foot is mildly swollen and tender on deep palpation of the 2nd and 3rd metatarsals. This is an initial imaging situation as there has been no prior imaging.
Scan ordered:   For MRI of mid and forefoot without IV contrast to assess for stress fracture",0.7613441706108451,0.7499870704715371,0.7417182200344219,0.7408443969436089,0.7392064998242599,0.7466200715769346,0.7709335584110133,0.7592900233618297,0.7554518981320706,0.7530068116257046,0.7520510356248766,0.7581466654310989,0.7523833685040167
