,ACR scenario,Guideline,Variant,Appropriateness Category,MRI scan ordered,Clinical File,queries,Table_1,Table_2,Table_3,Table_4,Table_5,avg_table,Text_1,Text_2,Text_3,Text_4,Text_5,avg_text,avg_overall
0,Traumatic shoulder pain. Nonlocalized shoulder pain. Negative radiographs. Next imaging study.,ACR shoulder pain traumatic.pdf,2,UA,MRI shoulder without IV contrast,"22 year old Chinese Male. No significant past medical history.  Right shoulder pain for 2 weeks after being tackled in rugby match.  On examination, reduced range of motion, tendereness.  Sulcus sign positive.  Apprehension test positive. O'Brien test positive.  Shoulder X-Ray shows no fracture or dislocation.  MRI right shoulder without IV contrast to assess for instability.","Patient Profile: The patient is a 22-year-old male with right shoulder pain for 2 weeks following a rugby match. He has a reduced range of motion and tenderness in the shoulder. His Sulcus sign, Apprehension test, and O'Brien test are all positive. An initial shoulder X-Ray shows no fracture or dislocation.
Scan ordered:   MRI right shoulder without IV contrast to assess for instability",0.7707188923650321,0.7678619041570853,0.7661359166842966,0.757672092614967,0.7561573098266259,0.7637092231296014,0.7806739030828203,0.7745896244510687,0.7740586305878436,0.7708854489839123,0.7699809353361826,0.7740377084883655,0.7688734658089835
1,Known axial spondyloarthritis. Follow-up for treatment response or disease progression.,ACR inflammatory back pain.pdf,4,MBA,MRI sacroiliac joints without and with IV contrast,"43 year old Indian Male.  Known ankylosing spondylitis on infliximab.  No breakthrough symptom.  No fever, loss of weight/appetite, abnormal sensation/weakness, shortness of breath.  Baseline MRI done pre treatment.  MRI sacroiliac joints with and wihout IV contrast to assess disease activity/response. ","Patient Profile: The patient is a 43-year-old Indian male with a known diagnosis of ankylosing spondylitis. He is currently on infliximab treatment. There are no breakthrough symptoms, no fever, loss of weight/appetite, abnormal sensation/weakness, or shortness of breath. A baseline MRI was done before treatment.
Scan ordered:   MRI sacroiliac joints with and wihout IV contrast to assess disease activity/response",0.7820520346248505,0.7685691556580635,0.7658479021026485,0.7613171999542102,0.7584828583853824,0.7672538301450309,0.7825321712997809,0.7804039257948523,0.7781874432505733,0.773849494535636,0.7711460891218553,0.7772238248005395,0.7722388274727852
2,Acute blunt or penetrating trauma to the hand or wrist. Initial imaging.,ACR acute hand and wrist trauma.pdf,1,UNA,MRI wrist without IV contrast,"38 year old Bangladeshi Male.  No significant past medical history.   Was using power drill when it slipped and penetrated right wrist.  On examination: oozing wound on dorsum of right wrist, no obvious bone visualised.  Wrist swelling. Unable to assess range of motion due to pain.  Nil imaging performed thus far.   MRI right wrist without IV contrast to assess soft tissue and bony injury.  ","Patient Profile: The patient is a 38-year-old male with no significant past medical history. He had an accident with a power drill which resulted in a penetrating injury to his right wrist. The patient is experiencing pain and swelling in the wrist, and range of motion could not be assessed due to the pain. No imaging has been performed yet.
Scan ordered:    MRI right wrist without IV contrast to assess soft tissue and bony injury",0.785688594831265,0.7761350369959605,0.7650964363916,0.7598461212397694,0.7583990021243799,0.769033038316595,0.7788157305012214,0.7770274666390735,0.7728883851167633,0.7672950462900954,0.7665797059940365,0.7725212669082382,0.7707771526124165
3,Suspect penetrating trauma with a foreign body in the soft tissues in the hand or wrist. Initial radiographs are negative. Next imaging study.,ACR acute hand and wrist trauma.pdf,7,MBA,MRI hand without IV contrast,"17 year old Malay Female.  No significant past medical history.  Was in wood crafting workshop 1 week ago.  Felt ?splinter penetrating left hand.  Pain is persistent.  On examination: mild swelling at left thenar eminence, no significant erythema or obvious foreign body.  Mildly tender.  X-rays is unremarkable.  MRI left hand without IV contrast to assess for foreign body. ","Patient Profile: The patient is a 17-year-old female with persistent pain in her left hand following a possible splinter penetration during a wood crafting workshop. There is mild swelling at the left thenar eminence and tenderness, but no significant erythema or obvious foreign body. Initial X-rays were unremarkable.
Scan ordered:   MRI left hand without IV contrast to assess for foreign body",0.7642795020734761,0.7309692126464482,0.7211961714977475,0.7202934371605478,0.7193854867142854,0.731224762018501,0.7344216128120421,0.7338210911955182,0.725506180264393,0.7228419631610894,0.7219023791861948,0.7276986453238475,0.7294617036711742
4,"Initial radiographs showing metacarpophalangeal, proximal interphalangeal, or distal interphalangeal joint malalignment in the absence of fracture. Next imaging study.",ACR acute hand and wrist trauma.pdf,6,UA,MRI hand without IV contrast,"28 year old Chinese Female.  No significant past medical history.  Kickboxing sparring, felt pain at lateral aspect of right hand after punching opponent.  On examination: deformity over right 4th metacarpophalangeal joint, tender, swollen.  X-rays show 4th metacarpophalaneal joint dislocation.  No fracture.  MRI right hand without IV contrast to assess ligamentous/tendon injury.  ","Patient Profile: The patient is a 28-year-old Chinese female with no significant past medical history. She experienced pain at the lateral aspect of her right hand after a kickboxing sparring session. Upon examination, there was a deformity over her right 4th metacarpophalangeal joint, which was tender and swollen. X-rays showed a 4th metacarpophalaneal joint dislocation, but no fracture.
Scan ordered:   MRI right hand without IV contrast to assess ligamentous/tendon injury",0.7648941440932006,0.735656402572209,0.7289902836886971,0.7256270343965384,0.7246500097333585,0.7359635748968006,0.750575387639481,0.7503856563326271,0.7418076619554065,0.7379422190372048,0.7332936336685705,0.742800911726658,0.7393822433117293
5,Acute hip pain. Fall or minor trauma. Suspect fracture. Initial imaging.,ACR acute hip pain suspected fracture.pdf,1,UNA,MRI pelvis and affected hip without IV contrast,"78 year old Indian Female.  Past medical history of diabetes mellitus and hypertension on follow up with polyclinic.  Tripped and fell, subsequently unable to walk due to left hip pain.  On examination: left limb foreshortening, externally rotated, reduced range of motion due to pain.  Nil imaging performed thus far.  MRI pelvis and left hip without IV contrast to assess for pelvic/hip fracture and alignment.  ","Patient Profile: The patient is a 78-year-old female with a history of diabetes mellitus and hypertension. She tripped and fell and is now unable to walk due to left hip pain. Her left limb is foreshortened, externally rotated, and has a reduced range of motion due to pain. No imaging has been performed yet.
Scan ordered:   MRI pelvis and left hip without IV contrast to assess for pelvic/hip fracture and alignment",0.771298221616002,0.7706362424307442,0.7545299859380491,0.7530756076244678,0.7499567402941267,0.759899359580678,0.7616653901296718,0.7562272126829613,0.7562202712180449,0.7531579692993835,0.7509535170912554,0.7556448720842633,0.7577721158324706
6,Acute hip pain. Fall or minor trauma. Negative radiographs. Suspect fracture. Next imaging study.,ACR acute hip pain suspected fracture.pdf,2,UA,MRI pelvis and affected hip without IV contrast,"45 year old Malay Female.  Past medical history of end stage renal failure due to membranous glomerulonephritis, anemia, hypertension, chronic headache.  Slipped in bathroom, subsequently unable to get up due to right hip pain.  On examination: no significant right limb foreshortening or external rotation.  Minor abrasions over thigh and calf.  Reduced range of motion of right hip due to pain.  X-rays show no obvious hip fracture or dislocation.  MRI pelvis and right hip witout IV contrast to asssess for radiographically occult pelvic/hip fracture.","Patient Profile: The patient is a 45 year old female with a history of end stage renal failure, anemia, hypertension, and chronic headache. She slipped in the bathroom and is now unable to get up due to right hip pain. There is a reduced range of motion in her right hip due to the pain. X-rays show no obvious hip fracture or dislocation.
Scan ordered:   MRI pelvis and right hip witout IV contrast to asssess for radiographically occult pelvic/hip fracture",0.7722855015543844,0.7649478068694187,0.7632589636104913,0.7615802948423038,0.7512634567130042,0.7626672047179205,0.7725425398757516,0.7721704766455322,0.7691163338753596,0.768612456252209,0.7665973431974009,0.7698078299692506,0.7662375173435856
7,"Adult or child 5 years of age or older. Acute trauma to the ankle. No exclusionary criteria present (eg, neurologically intact (including no peripheral neuropathy)). Patient meets the requirements for evaluation by the Ottawa Ankle Rules which are negative: No point tenderness over the malleoli, talus, or calcaneus on physical examination. Able to walk. Initial imaging.",ACR Acute trauma to ankle.pdf,2,UNA,MRI ankle without IV contrast,"50 year old Chinese male.  Past medical history of hypertension on medical treatment.  Was jogging 1 week ago when tripped on a rock and twisted right ankle.  Pain since then.  Was able to continue jogging immediately after incident. No abnormal sensation.  On examination: able to walk normally.  No point tenderness at right ankle or midfoot (lateral malleolus, medial malleolus, navicular) or base of 5th metatarsal.   Full range of motion with mild pain on foot supination. No prior imaging.  MRI right ankle without IV contrast to assess for ligamentous injury.","Patient Profile: The patient is a 50-year-old male with a history of hypertension. He experienced a twisting injury to his right ankle while jogging a week ago and has had pain since then. He was able to continue jogging immediately after the incident and is currently able to walk normally. There is mild pain on foot supination, but no point tenderness at the right ankle or midfoot. There has been no prior imaging.
Scan ordered:   MRI right ankle without IV contrast to assess for ligamentous injury",0.7523267868488431,0.7431058267891403,0.7385952860205358,0.7362674444175559,0.7287184167430271,0.7398027521638204,0.7646710302972954,0.7580068675342986,0.7541097357870639,0.7499350159689022,0.7487543122039345,0.7550953923582989,0.7474490722610596
8,Adult or child 5 years of age or older. Acute trauma to the ankle. Radiographs negative for osseous injury and physical examination or radiographs demonstrate alignment abnormality suggesting syndesmotic/ligamentous injury or dislocation. Next study,ACR Acute trauma to ankle.pdf,6,UA,MRI ankle without IV contrast,"17 year old Indian male.  No significant past medical history.  Was playing soccer when another player tackled him, twisting right ankle.  Unable to walk for about 10 mins after that.  Subsequently able to weight bear with assistance.  On examination: Point tenderness at tip of lateral malleolus.  Abnormal widening of lateral ankle on varus stress.  X-rays: no fracture or dislocation or osteochondral injury.  MRI right ankle without IV contrast to assess for ligamentous injury.  ","Patient Profile: The patient is a 17-year-old male with no significant past medical history. He was injured while playing soccer, resulting in a twisted right ankle. He was unable to walk for about 10 minutes after the incident but was subsequently able to bear weight with assistance. Examination revealed point tenderness at the tip of the lateral malleolus and abnormal widening of the lateral ankle on varus stress. X-rays showed no fracture, dislocation, or osteochondral injury.
Scan ordered:   MRI right ankle without IV contrast to assess for ligamentous injury",0.801239463081973,0.7865804642866675,0.7778946787561447,0.7598168868759865,0.747939134692241,0.7746941255386026,0.8078161901248619,0.7833105792862307,0.7823114082647928,0.7794126318964356,0.7721846294464233,0.7850070878037488,0.7798506066711757
9,"Adult or child older than 5 years of age. Acute trauma to the foot. Suspect Lisfranc injury, tendon injury, or occult fracture or dislocation. Radiographs are normal or equivocal. Next imaging study.",ACR acute trauma to foot.pdf,5,UA,MRI foot without IV contrast,"24 year old Bangladeshi male, construction worker.  No significant past medical history.  Large trolley carrying metal poles rolled over left foot.  Severe pain, unable to walk without assistance.  On examination: tender over midfoot/base of forefoot.  Severe foot swelling.  X-rays: equivocal widening of interval between base of 1st and 2nd metatarsals.  no definite fracture.  MRI left foot without IV contrast to assess for Lis Franc injury.","Patient Profile: The patient is a 24-year-old male with no significant past medical history. He is a construction worker who had a large trolley carrying metal poles roll over his left foot. He is experiencing severe pain and is unable to walk without assistance. Upon examination, there is tenderness over the midfoot/base of the forefoot and severe foot swelling. X-rays show equivocal widening of the interval between the base of the 1st and 2nd metatarsals, but no definite fracture.
Scan ordered:   MRI left foot without IV contrast to assess for Lis Franc injury",0.7794328523995573,0.7379203149399497,0.7370510540493195,0.736281970482438,0.7314171100737883,0.7444206603890106,0.7633079392352418,0.7609325296895054,0.7561264324717046,0.7486022089084695,0.7481618704702173,0.7554261961550278,0.7499234282720192
10,"Adult or child 5 years of age or older. Significant trauma to the knee (eg, motor vehicle accident, knee dislocation). Initial imaging.",ACR acute trauma to knee.pdf,7,MBA,MRI knee without IV contrast,"62 year old Caucasian female.  Past medical history of fibroids and adenomyosis.  Was driving but lost control on wet road, swerved and hit road divider at low speed around 50km/h.  Left knee hit dashboard, swelling and pain after injury, hobbled out of car.  Otherwise no other injuries.  On examination: severe swelling and bruising of left knee, unable to accurately assess range of motion or perform stress maneuvers due to pain.  No other injury elsewhere.  No imaging performed thus far.  MRI left knee without IV contrast to assess knee for bony and soft tissue injury.","Patient Profile: The patient is a 62-year-old Caucasian female who was involved in a car accident where her left knee hit the dashboard. She is experiencing severe swelling and pain in her left knee, and no range of motion or stress maneuvers could be performed due to the pain. No imaging has been performed yet.
Scan ordered:   MRI left knee without IV contrast to assess knee for bony and soft tissue injury",0.7506865692549547,0.7324449499867797,0.7310785794195541,0.7309388891398934,0.7281011194832667,0.7346500214568896,0.7507585888313876,0.7499996990942596,0.7440312089780161,0.7411828993805303,0.7398645223102824,0.7451673837188951,0.7399087025878923
11,"Adult or child 5 years of age or older. Acute trauma to the knee. Mechanism unknown. Focal patellar tenderness, effusion, able to walk. Initial imaging",ACR acute trauma to knee.pdf,6,UNA,MRI knee without IV contrast,"48 year old Malay female.  No significant past medical history.  Was jogging when felt sharp pain in right knee.  No known inciting event.  Pain for 2 weeks since then, still able to walk.  On examination: antalgic gait, mild anterior knee tenderness, small knee effusion.  Anterior drawer positive.  No imaging performed thus far. MRI right knee without IV contrast to assess knee for ACL injury.  ","Patient Profile: The patient is a 48-year-old female who experienced a sharp pain in her right knee while jogging. The pain has persisted for 2 weeks. She is still able to walk but has an antalgic gait, mild anterior knee tenderness, and a small knee effusion. The anterior drawer test is positive. No imaging has been performed yet.
Scan ordered:  MRI right knee without IV contrast to assess knee for ACL injury",0.7597954656627559,0.7521326677181005,0.7471191445853077,0.7444274947955194,0.7436008502106346,0.7494151245944637,0.7581011881761206,0.7549514152562083,0.7459541674981973,0.7456659072095406,0.7441404010661836,0.7497626158412501,0.7495888702178569
12,Adult or skeletally mature child. Fall or acute twisting trauma to the knee. No fracture seen on radiographs. Suspect occult fracture or internal derangement. Next study.,ACR acute trauma to knee.pdf,3,UA,MRI knee without IV contrast,"15 year old Indonesian male.  No significant past medical history.  Was playing soccer, tripped on pothole in field and twisted left knee.  Felt a pop sensation.  On examination:  Knee swelling and effusion.  Mild medial joint line tenderness.  Anterior drawer equivocal.  X-rays show no fracture or dislocation.  MRI left knee without IV contrast to assess for ligamentous and meniscal injury.  ","Patient Profile: The patient is a 15-year-old male with no significant past medical history. He was playing soccer and tripped on a pothole, twisting his left knee and feeling a pop sensation. His examination shows knee swelling and effusion, mild medial joint line tenderness, and an equivocal anterior drawer. X-rays show no fracture or dislocation.
Scan ordered:   MRI left knee without IV contrast to assess for ligamentous and meniscal injury",0.7815689662075509,0.7790613364949731,0.777900544094461,0.7609530985113037,0.747027414768263,0.7693022720153103,0.7630096529318642,0.7577168401559047,0.7575789687089466,0.7555234967475996,0.7545551715137756,0.7576768260116181,0.7634895490134642
13,Chronic ankle pain. Multiple sites of degenerative joint disease in the hindfoot detected by ankle radiographs. Next study.,ACR chronic ankle pain.pdf,2,MBA,MRI ankle and hindfoot without IV contrast ,"65 year old Chinese male.  Past medical history of diabetes, hypertension, ascending colon cancer post right hemicolectomy.  Complains of right ankle pain for years, worsening recently with stiffness and particularly when floor is not smooth/even.   Works as an odd job labourer.  On examination:  pes planus.  stiff when rocking hindfoot. no significant tenderness.  X-rays show moderate tibiotalar, subtalar and talonavicular degeneration.  MRI right ankle and hindfoot without IV contrast to further assess degeneration.","Patient Profile: The patient is a 65-year-old male with a past medical history of diabetes, hypertension, and ascending colon cancer post right hemicolectomy. He has been experiencing right ankle pain for years, which has recently worsened, accompanied by stiffness, particularly when the floor is not smooth or even. He works as an odd job labourer. Upon examination, pes planus was observed, and the patient was stiff when rocking the hindfoot. There was no significant tenderness. X-rays show moderate tibiotalar, subtalar, and talonavicular degeneration.
Scan ordered:   MRI right ankle and hindfoot without IV contrast to further assess degeneration",0.7821528144600945,0.7592859049666956,0.7581689481390337,0.7571384270050079,0.7552919290168789,0.7624076047175421,0.761307368605135,0.7592270958161329,0.7566548666554774,0.7543511700400879,0.7502756596412801,0.7563632321516227,0.7593854184345824
14,"Chronic ankle pain. Ankle radiographs normal, suspected osteochondral lesion. Next study.",ACR chronic ankle pain.pdf,3,UA,MRI ankle without IV contrast,"49 year old Malay male.  Past medical history of right wrist fracture post open reduction and internal fixation.  Senior warrant officer in Army, logistics.  8 month history of left ankle pain, no inciting event, sometimes feels that ankle is stuck but feeling goes away after a while. On examination: no significant abnormality.   X-ray shows no fracture or dislocation, mild ankle degeneration, talar dome is smooth.  MRI right ankle without IV contrast to assess for osteochondral lesion.","Patient Profile: The patient is a 49 year old male with a past medical history of right wrist fracture post open reduction and internal fixation. He has been experiencing left ankle pain for 8 months without any known cause. He sometimes feels that his ankle is stuck but the feeling goes away after a while. An X-ray shows no fracture or dislocation, but mild ankle degeneration and a smooth talar dome.
Scan ordered:   MRI right ankle without IV contrast to assess for osteochondral lesion",0.7690695296926449,0.7634704707440405,0.7621945606259117,0.7574005814194554,0.7517776707503497,0.7607825626464805,0.7614986132184746,0.7612101536146705,0.753311469707143,0.7426045377417281,0.7425817206808952,0.7522412989925823,0.7565119308195314
15,Chronic elbow pain. Initial imaging.,ACR chronic elbow pain.pdf,1,UNA,MRI elbow without IV contrast,"70 year old Malay female.  Past medical history of diabetes, left breast cancer post simple mastectomy and axillary clearance 5 years ago.  Works as a dishwasher.  Left handed.  1 year history of left elbow pain, worsening over the past few months.  No trauma.  No other joint pain/stiffness.  Worse at end of day.  On examination, crepitus felt on otherwise full range of motion.  No point tenderness or obvious effusion.  No prior imaging.  MRI left elbow without IV contrast to assess for degeneration.  ","Patient Profile: The patient is a 70-year-old female with a past medical history of diabetes and left breast cancer. She has been experiencing left elbow pain for a year, which has been worsening over the past few months. There is no history of trauma, joint pain/stiffness, or prior imaging. The pain worsens at the end of the day. On examination, crepitus was felt on otherwise full range of motion. There was no point tenderness or obvious effusion.
Scan ordered:   MRI left elbow without IV contrast to assess for degeneration",0.760948766993245,0.7596223745292505,0.7571685963204938,0.7477945736279685,0.7471882165551589,0.7545445056052233,0.7649023505610982,0.7582758535449259,0.7512703078993388,0.7493243998200935,0.7452233648737374,0.7537992553398387,0.754171880472531
16,Chronic elbow pain. Suspect chronic epicondylalgia or tendon tear. Refractory to empirical treatment. Radiographs normal or nonspecific. Next imaging study.,ACR chronic elbow pain.pdf,4,UNA,MRI elbow without and with IV contrast,"33 year old Indian male.  Professional tennis player.  History of right ankle degeneration, left knee lateral meniscal tear post arthroscopic repair. Right handed.  On and off right elbow pain, worsening over the past month.  Worse during tennis, with weakening grip on racquet.  On examination, exquisitely tender at lateral epicondyle.  X-rays show no fracture, dislocation or elbow effusion.  MRI elbow without and with IV contrast to evaluate for lateral epicondylitis.     ","Patient Profile: The patient is a 33-year-old male professional tennis player. He has a history of right ankle degeneration and left knee lateral meniscal tear post arthroscopic repair. He is experiencing worsening right elbow pain over the past month, which is worse during tennis and is causing a weakening grip on his racquet. Examination shows extreme tenderness at the lateral epicondyle. X-rays show no fracture, dislocation, or elbow effusion.
Scan ordered:   MRI elbow without and with IV contrast to evaluate for lateral epicondylitis",0.7703281591483254,0.7585757707651113,0.7483937501995359,0.7408145027384276,0.7319063973750897,0.7500037160452979,0.7649488783395632,0.7634487872589382,0.7602891447528861,0.7580986803377312,0.7538152236911271,0.7601201428760491,0.7550619294606735
17,Chronic elbow pain. Suspect nerve abnormality. Radiographs normal or nonspecific. Next imaging study.,ACR chronic elbow pain.pdf,6,UA,MRI elbow without IV contrast,"64 year old Chinese female.  Secretary.  Right handed.  Hyperlipidemia on statins.  Presenting with worsening numbness and tingling along the ulnar aspect of right hand.  On examination, mild wasting at 4th interosseous and hypothenar eminence.  Tinel's positive at cubital tunnel.  X-rays show no significant abnormality at elbow or hand apart from mild degeneration.  MRI elbow without IV contrast to assess for ulnar nerve entrapment.  ","Patient Profile: The patient is a 64-year-old Chinese female. She is experiencing worsening numbness and tingling along the ulnar aspect of her right hand. On examination, there is mild wasting at the 4th interosseous and hypothenar eminence. Tinel's is positive at the cubital tunnel. X-rays show no significant abnormality at the elbow or hand apart from mild degeneration. The patient has a history of hyperlipidemia and is on statins.
Scan ordered:   MRI elbow without IV contrast to assess for ulnar nerve entrapment",0.7276285145465726,0.712881422804995,0.707336686792081,0.7045686694090711,0.7008749019337285,0.7106580390972896,0.7391748873491885,0.7389452253139212,0.7319448320275614,0.7223634717000531,0.7204552906619477,0.7305767414105344,0.720617390253912
