,ACR scenario,Guideline,Variant,Appropriateness Category,MRI scan ordered,Clinical File,queries,Table_1,Table_2,Table_3,Table_4,Table_5,avg_table,Text_1,Text_2,Text_3,Text_4,Text_5,avg_text,avg_overall
18,"Chronic extremity joint pain. Suspect inflammatory (seropositive or seronegative arthritis), crystalline (gout or pseudogout), or erosive osteoarthritis. Initial imaging.",ACR chroni extremity joint pain inflammatory arthritis.pdf,1,UNA,MRI area of interest without and with IV contrast,"46 year old Chinese male.  Businessman, sales.  Frequent drinker due to job, about 1-2 beers/day.  Past medical history of fatty liver, acute cholecystitis post cholecystectomy.  Now presenting with severe pain at right big toe for 2 weeks, pain on and off improves with paracetamol and ibuprofen.  On examination: swelling and erythema at right big toe 1st metatarsophalangeal joint.  No prior imaging.  MRI forefoot with and without IV contrast for evaluation of gout.  ","Patient Profile: The patient is a 46-year-old male with a history of fatty liver and acute cholecystitis post cholecystectomy. He is currently experiencing severe pain in his right big toe for the past 2 weeks, which improves with paracetamol and ibuprofen. Upon examination, there is swelling and erythema at the right big toe's 1st metatarsophalangeal joint. This is the initial imaging stage, and there is no prior imaging.
Scan ordered:   MRI forefoot with and without IV contrast for evaluation of gout",0.745977510588342,0.7200265088012354,0.7160545779560191,0.7154366010465817,0.7153728734067231,0.7225736143597803,0.7153916350529845,0.7137724214687043,0.7112370068293861,0.7093567162649936,0.7088304925151008,0.7117176544262339,0.7171456343930072
19,Chronic extremity joint pain. Suspect erosive osteoarthritis. Radiographs normal or inconclusive. Next imaging study.,ACR chroni extremity joint pain inflammatory arthritis.pdf,5,MBA,MRI area of interest without and with IV contrast,"55 year old Philipino female.  Domestic helper.  No significant past medical history.  Bilateral finger joint pain, swelling and stiffness worse in the morning for 4 months, worsening recently.  No eye redness, shortness of breath, fever, loss of weight/appetite.  No other joint involvement.  On examination: Heberden's nodes bilateral distal interphalangeal joints, mild swelling, no significant tenderness.  X-rays show degenerative changes in bilateral hand interphalangeal joints with equivocal gull-wing deformity.  MRI of bilateral hands with and without IV contrast to assess for erosive osteoarthritis. ","Patient Profile: The patient is a 55-year-old female with no significant past medical history. She has been experiencing bilateral finger joint pain, swelling, and stiffness that is worse in the morning for the past 4 months, and the symptoms have been worsening recently. There is no other joint involvement. Physical examination revealed Heberden's nodes in the bilateral distal interphalangeal joints and mild swelling. X-rays show degenerative changes in bilateral hand interphalangeal joints with an equivocal gull-wing deformity.
Scan ordered:   MRI of bilateral hands with and without IV contrast to assess for erosive osteoarthritis",0.7411358071889333,0.7380980735823605,0.7374198208138368,0.7339801002143537,0.7321957975259017,0.7365659198650772,0.7427331762293654,0.7379809706492069,0.7377174250602881,0.73129282884543,0.7292794653617168,0.7358007732292015,0.7361833465471394
20,Chronic foot pain. Unknown etiology. Initial imaging.,ACR chronic foot pain.pdf,1,UNA,MRI foot without IV contrast,"80 year old Indonesian female.  Prior total hysterectomy and bilateral salpingo-oophrectomy for endometrial cancer 20 years ago.  Now presenting with right foot pain for 6 months, worse after exercise.  Does a lot of brisk walking.  On examination, tenderness over metatarsal head/neck regions.  No prior imaging.  MRI right foot to assess for stress fracture/injury.  ","Patient Profile: The patient is an 80-year-old female who has been experiencing right foot pain for 6 months, which worsens after exercise. She engages in a lot of brisk walking. Upon examination, there is tenderness over the metatarsal head/neck regions. She has a history of total hysterectomy and bilateral salpingo-oophrectomy for endometrial cancer 20 years ago. There has been no prior imaging.
Scan ordered:   MRI right foot to assess for stress fracture/injury",0.7583185430891042,0.7321988524912041,0.7296727651821907,0.725168202652873,0.7204512755510991,0.7331619277932943,0.755115115448896,0.7436043959842509,0.7419980106247741,0.7413614660456997,0.7358993416561159,0.7435956659519473,0.7383787968726208
21,Chronic plantar heel pain. Radiographs negative or equivocal. Clinical concern includes plantar fasciitis or plantar fascia tear. Next imaging study.,ACR chronic foot pain.pdf,4,UA,MRI foot without IV contrast,"49 year old Indian female.  Past medical history of fibroids, endometriosis, gestational diabetes, bilateral breast fibroadenomas.  Now presenting with bilateral heel pain and stiffness for 5 months, worse on the left.  Perimenopausal.  Worse when just waking up.  On examination, bilateral pes planus, tender at insertion of plantar fascia on calcaneum.  X-rays show no significant abnormality, in particular no plantar calcaneal spur.  MRI bilateral feet without IV contrast to assess for plantar fasciiitis.  ","Patient Profile: The patient is a 49-year-old Indian female with a past medical history of fibroids, endometriosis, gestational diabetes, and bilateral breast fibroadenomas. She is currently experiencing bilateral heel pain and stiffness for 5 months, which is worse on the left and when just waking up. She is perimenopausal. On examination, she has bilateral pes planus and is tender at the insertion of the plantar fascia on the calcaneum. X-rays show no significant abnormality, in particular no plantar calcaneal spur.
Scan ordered:   MRI bilateral feet without IV contrast to assess for plantar fasciiitis",0.7609701980432754,0.730644977533598,0.7268640857329878,0.7153518311002516,0.7113452020683967,0.729035258895702,0.7464950699453579,0.7325537079490725,0.7260991400026355,0.7257503959966249,0.7152434101413895,0.729228344807016,0.7291318018513591
22,Chronic wrist pain. Routine radiographs normal or nonspecific. Persistent symptoms. Next study.,ACR chronic hand and wrist pain.pdf,2,MBA,MR arthrography wrist,"52 year old Chinese male.  Shipyard supervisor.  Past medical history of appendicectomy, cholecystectomy, Hep B carrier on follow up with polyclinic.  Right handed.  Now complains of 1 year history of right wrist ulnar sided pain and reduced grip strength.  Pain not worsening but pain score is about 6 out of 10 consistently, worse on activities.  Unable to play badminton properly.  On examination, right wrist positive fovea sign, pain elicited on ulnar deviation of wrist.    X-rays show non mild specific degenerative changes in the wrist.  MRI arthrography of the right wrist to assess for triangular fibrocartilage complex injury.  ","Patient Profile: The patient is a 52-year-old male who has been experiencing right wrist ulnar sided pain and reduced grip strength for a year. The pain is consistent and worsens with activities. He is unable to play badminton properly due to this condition. Physical examination reveals a positive fovea sign and pain is elicited on ulnar deviation of the wrist. X-rays show mild non-specific degenerative changes in the wrist.
Scan ordered:   MRI arthrography of the right wrist to assess for triangular fibrocartilage complex injury",0.7976858799981532,0.7777957397143949,0.7740285264612159,0.764012097758867,0.7583309278004596,0.7743706343466181,0.7666574543828677,0.765458657923976,0.7628859375626145,0.7627653338227294,0.7602838653681634,0.7636102498120702,0.7689904420793441
23,Chronic wrist pain. Radiographs normal or nonspecific. Suspect carpal tunnel syndrome. Next study.,ACR chronic hand and wrist pain.pdf,2,MBA,MRI wrist without IV contrast,"46 year old Malay female.  Clerical assistant in healthcare.  Past medical history of obesity, diabetes mellitus, hyperlipidemia.  Right handed.  Now complains of 6 month history of numbness, tingling and weakness in outer part of right hand, sometimes waking her up at night.  Perimenopausal. On examination, positive Tinel's sign and carpal tunnel compression test at the right wrist.  No significant thenar atrophy.  X-rays show no significant abnormality.  MRI right wrist without IV contrast to assess for carpal tunnel syndrome.","Patient Profile: The patient is a 46-year-old female with a history of obesity, diabetes mellitus, and hyperlipidemia. She has been experiencing numbness, tingling, and weakness in the outer part of her right hand for the past 6 months, sometimes severe enough to wake her up at night. Physical examination revealed positive Tinel's sign and carpal tunnel compression test at the right wrist. There is no significant thenar atrophy. X-rays show no significant abnormality.
Scan ordered:   MRI right wrist without IV contrast to assess for carpal tunnel syndrome",0.7378474159258368,0.7186666199785169,0.7134007887245645,0.7092763869990022,0.7074521318032413,0.7173286686862322,0.7522164383598388,0.7477645103981085,0.7124922898412688,0.7096855903254942,0.6980703180445126,0.7240458293938445,0.7206872490400384
24,Chronic wrist pain. Radiographs normal or show nonspecific arthritis. Exclude infection. Next study.,ACR chronic hand and wrist pain.pdf,4,UNA,MR arthrography wrist,"30 year old Chinese female.  Long term volunteer in African community hospital (stays there long term, back home once a year).  No significant past medical history.  Left handed.  Now comes with painful swelling of left wrist for about 1 year, with mild skin discharge.  On examination, dorsal wrist swelling with skin sinus tracts and yellowish-cheesy discharge.  No tenderness.  X-rays shows no gross destructive bone lesion.  MRI arthrography of the left wrist to assess for TB tenosynovitis.  ","Patient Profile: The patient is a 30-year-old female who has been experiencing painful swelling of the left wrist for about a year. She also has mild skin discharge. Upon examination, dorsal wrist swelling with skin sinus tracts and yellowish-cheesy discharge was observed. X-rays show no gross destructive bone lesion.
Scan ordered:   MRI arthrography of the left wrist to assess for TB tenosynovitis",0.7584240004053917,0.7568769723588853,0.7539802953817218,0.7533357165631326,0.751652237185642,0.7548538443789548,0.7508872747429876,0.7440401229223114,0.7416674688618141,0.7384187940469615,0.7380443807687035,0.7426116082685558,0.7487327263237553
25,Chronic hip pain. Initial Imaging,ACR chronic hip pain.pdf,1,UNA,MRI hip without IV contrast,"55 year old Indonesian female.  No significant past medical history.  Former national sprinter and South East Asian games gold medallist.  Now presenting with chronic bilateral hip pain worse on the right, sometimes with locking sensation.  On examination:  pain on internal rotation, adduction and extension of bilateral hips.  No prior imaging. MRI bilateral hips without IV contrast to assess for hip labral tears.","Patient Profile: The patient is a 55 year old female with a history of being a national sprinter. She is presenting with chronic bilateral hip pain that is worse on the right side, and sometimes experiences a locking sensation. She has pain on internal rotation, adduction and extension of bilateral hips. There has been no prior imaging.
Scan ordered:  MRI bilateral hips without IV contrast to assess for hip labral tears",0.7693639712681284,0.7668778795375704,0.7535023849625603,0.7520149965976127,0.7488689734866355,0.7581256411705015,0.7555281576474243,0.7496032841541532,0.7493532304797881,0.7481678237825602,0.7478999493305412,0.7501104890788933,0.7541180651246975
26,"Chronic hip pain. Suspect noninfectious extra-articular abnormality, such as tendonitis or bursitis. Radiographs negative or nondiagnostic. Next imaging study.",ACR chronic hip pain.pdf,2,UNA,MRI hip without and with IV contrast,"22 year old Indian male. No significant past medical history.  Marathon runner.  Now presenting with 5 month history of left hip pain, lateral sided.  Will get better on taking voltaren and paracetamol but does not want to take medication long term.  On examination, tender over left hip greater trochanter.  X-rays show no significant abnormality.  MRI hip with and without IV contrast to assess for trochanteric bursitis.        ","Patient Profile: The patient is a 22-year-old male with a 5-month history of left hip pain, lateral sided. He is a marathon runner. His pain improves with voltaren and paracetamol, but he does not want to take these medications long term. On examination, he is tender over the left hip greater trochanter. X-rays show no significant abnormality.
Scan ordered:   MRI hip with and without IV contrast to assess for trochanteric bursitis",0.7598233032981265,0.7548205256448128,0.733620137342299,0.7302346138526856,0.7285984808548668,0.7414194121985581,0.7376545046916705,0.7372478063071877,0.7342265557023137,0.7333461285030416,0.7298752480004896,0.7344700486409407,0.7379447304197494
27,Chronic hip pain. Suspect labral tear. Radiographs negative or nondiagnostic. Next imaging study.,ACR chronic hip pain.pdf,4,UA,MR arthrography hip,"30 year old Vietnamese male.  No significant past medical history.  Office worker, but avid badminton player about three times a week.  Now presenting with 4 month history of left anterior hip/groin pain with clicking.  Describes it as mostly in the background with pain score of 3-4/10, but aggravates on prolonged sitting and also during badminton games.  On examination: no inguinal hernia.  Positive left hip anterior impingement test.  X-rays are unremarkable, with no evidence of hip dysplasia.  MRI arthrography of the left hip to assess for labral tear. ","Patient Profile: The patient is a 30-year-old male with no significant past medical history. He is an office worker and plays badminton three times a week. He has been experiencing left anterior hip/groin pain with clicking for the past 4 months. The pain is mostly in the background with a pain score of 3-4/10, but it worsens during prolonged sitting and during badminton games. Upon examination, no inguinal hernia was found, but a positive left hip anterior impingement test was noted. X-rays showed no evidence of hip dysplasia.
Scan ordered:   MRI arthrography of the left hip to assess for labral tear",0.7429331944501772,0.7409578248508149,0.7391872898524665,0.7341235975378656,0.7251168983001689,0.7364637609982986,0.7250441837324338,0.7244696170910399,0.7218397750916551,0.7205333213765046,0.7146905824912231,0.7213154959565713,0.7288896284774349
28,Adult or child greater than or equal to 5 years of age. Chronic knee pain. Initial knee radiograph negative or demonstrates joint effusion. Next imaging procedure,ACR chronic knee pain.pdf,2,UNA,MRI knee without and with IV contrast,"27 year old Chinese female.  Avid jogger.  No significantly past medical history other than history of one abortion.  Now presenting with 8 months history of bilateral knee pain, worse on the right.  Pain score about 4-5/10, worse on jogging where it increases to 7-8/10.  No fever, no night pain.  On examination, bilateral knee crepitus, no joint line tenderness, pivot shift negative, anterior and posterior drawer negative, varus/valgus stress negative, small bilateral joint effusions.    X-rays show mild bilateral knee degeneration.  MRI bilateral knees with and without IV contrast to further assess for degenerative changes. ","Patient Profile: The patient is a 27-year-old Chinese female who is an avid jogger. She has been experiencing bilateral knee pain for 8 months, which is worse on the right side. The pain score is about 4-5/10, but it increases to 7-8/10 when jogging. There is no fever or night pain. Physical examination reveals bilateral knee crepitus, no joint line tenderness, pivot shift negative, anterior and posterior drawer negative, varus/valgus stress negative, and small bilateral joint effusions. X-rays show mild bilateral knee degeneration.
Scan ordered:   MRI bilateral knees with and without IV contrast to further assess for degenerative changes",0.7544277231482869,0.7532639211943732,0.7528867599647058,0.7474998768775314,0.7366323285292034,0.7489421219428202,0.7545737464144943,0.7535177276005863,0.7448518722453461,0.7365854157053122,0.7327536490385933,0.7444564822008665,0.7466993020718433
29,Adult or child greater than or equal to 5 years of age. Chronic knee pain. Initial knee radiograph demonstrates degenerative changes or chondrocalcinosis. Next imaging procedure.,ACR chronic knee pain.pdf,4,MBA,MRI knee without IV contrast,"71 year old Indian male. Retiree. Past medical history of lung cancer post right upper lobectomy, ischemic heart disease post coronary stenting, hypertension.  Community ambulant, unassisted.  Does brisk walking.   Now presenting with few year history of bilateral knee pain, worse on the left.  Pain score 5/10 worse on walking where it is 7/10.  On examination, bilateral knee significant crepitus, small bilateral joint effusions, otherwise unremarkable.  X-rays show severe right and moderate left knee degeneration and small bilateral suprapatellar effusions.  MRI bilateral knees without IV contrast to assess extent of degeneration.  ","Patient Profile: The patient is a 71-year-old male with a history of lung cancer and ischemic heart disease. He is currently experiencing bilateral knee pain, which is worse on the left and exacerbated by walking. Physical examination reveals significant crepitus and small bilateral joint effusions in both knees. X-rays show severe right and moderate left knee degeneration and small bilateral suprapatellar effusions.
Scan ordered:   MRI bilateral knees without IV contrast to assess extent of degeneration",0.7654758130753752,0.7542522807701011,0.7439183526010417,0.7386611484265652,0.7360395192820077,0.7476694228310181,0.7629410738036475,0.751194500538972,0.7436603328001935,0.7388189162901893,0.7349132166290048,0.7463056080124014,0.7469875154217098
30,"Adult or child greater than or equal to 5 years of age. Chronic knee pain. Initial knee radiograph demonstrates signs of prior osseous injury (ie, Segond fracture, tibial spine avulsion, etc). Next imaging procedure.",ACR chronic knee pain.pdf,5,UA,MRI knee without IV contrast,"16 year old Caucasian female.  Soccer player.  Now presenting with 6 month history of right knee pain.  Had episode of bad right knee sprain 6 months ago after being tackled during soccer game.  Felt a pop and swelling, but treated with ice, compression and over the counter medication.  Since then, has right knee pain, and feeling of instability.  Pain worsens on activity.  No night pain, no fever, no loss of weight/appetitie.  On examination, right knee anterior drawer positive, medial and lateral joint line tenderness.  No joint effusion.  X-rays shows suggestion of old Segond fracture.  MRI knee without IV contrast to assess for ACL and meniscal injury.  ","Patient Profile: The patient is a 16-year-old Caucasian female who is a soccer player. She has a 6-month history of right knee pain following a bad sprain during a soccer game. She experienced a pop and swelling at the time of the injury, which was treated with ice, compression, and over-the-counter medication. She has been experiencing right knee pain and a feeling of instability since the injury, with the pain worsening during activity. There is no night pain, fever, or loss of weight/appetite. Examination revealed a positive right knee anterior drawer, medial and lateral joint line tenderness, and no joint effusion. X-rays suggest an old Segond fracture.
Scan ordered:   MRI knee without IV contrast to assess for ACL and meniscal injury",0.7710509267624587,0.7563923166252391,0.7555657611277012,0.753017628434943,0.7525737283605448,0.7577200722621773,0.7834796231910273,0.7592803383802031,0.7584676928696582,0.7542510444552845,0.7479250696305393,0.7606807537053424,0.7592004129837598
31,Chronic shoulder pain. Suspect rotator cuff disorders or subacromial subdeltoid bursitis (no prior surgery). Initial radiographs normal or inconclusive. Next imaging study.,ACR chronic shoulder pain.pdf,2,UA,MRI shoulder without IV contrast,"28 year old Chinese male.  National bowler.  No significant past medical history. Right handed.  Now presenting with 3 month history of right shoulder pain.  No specific inciting incident.  Pain exacerbated on bowling.  Pain score 6/10.  Affecting bowling ability.  On examination, reduced active abduction.  Empty can test positive.  Neer test positive.  X-rays are unremarkable, with no reduced acromiohumeral interval.  MRI shoulder without IV contrast to assess for rotator cuff injury.  ","Patient Profile: The patient is a 28-year-old male with a 3-month history of right shoulder pain. The pain is exacerbated when bowling and is affecting his bowling ability. On examination, he has reduced active abduction, a positive empty can test, and a positive Neer test. His X-rays are unremarkable, with no reduced acromiohumeral interval. This is an initial imaging scenario.
Scan ordered:   MRI shoulder without IV contrast to assess for rotator cuff injury",0.7649908264353629,0.7647714223109953,0.7600131786468657,0.7542539217001692,0.7518396895747336,0.7591738077336253,0.771942916820487,0.7683695718804416,0.76668772880932,0.7642509854207411,0.7631043686596072,0.7668711143181194,0.7630224610258723
32,Chronic shoulder pain. Suspect adhesive capsulitis. Initial radiographs normal or inconclusive. Next imaging study.,ACR chronic shoulder pain.pdf,5,MBA,MR arthrography shoulder,"53 year old Malay female.  Home maker. Past medical history of diabetes mellitus, hyperlipidemia, left breast fibroadenoma.  Right handed.  Now presenting with 8 month history of left shoulder pain, worsening over time with associated stiffness.  No inciting event. No night pain or fever.  Unable to sleep on left side.  On examination, significant reduced range of motion of left shoulder due to pain and/or stiffness.  X-rays show minimal acromiohumeral degeneration, otherwise unremarakable.  MRI arthrography of the left shoulder to evaluated for adhesive capsulitis.","Patient Profile: The patient is a 53-year-old female with a history of diabetes mellitus, hyperlipidemia, and left breast fibroadenoma. She is currently experiencing left shoulder pain and stiffness for the past 8 months, which has been worsening over time. She has a significantly reduced range of motion in her left shoulder due to pain and/or stiffness. X-rays show minimal acromiohumeral degeneration. This is an initial imaging stage.
Scan ordered:   MRI arthrography of the left shoulder to evaluated for adhesive capsulitis",0.7872964953930912,0.7667280127865873,0.7632992721633698,0.762555158330835,0.7580919928092514,0.7675941862966269,0.768296229250811,0.757368958292519,0.7492956819233804,0.7439008381165078,0.7413748774031093,0.7520473169972655,0.7598207516469462
33,Chronic shoulder pain. History of prior rotator cuff repair. Suspect rotator cuff disorders or subacromial subdeltoid bursitis. Initial radiographs normal or inconclusive. Next imaging study.,ACR chronic shoulder pain.pdf,8,UNA,MRI shoulder without and with IV contrast,"41 year old Malay male.  Badminton player, representing club.  Right handed.  History of right shoulder arthroscopic rotator cuff repair 2 years ago.  Now presenting with 8 month history of right shoulder pain, limiting ability to participate in competitions.  Grip strength ok.  No night pain or fever.  On examination, impingement test is positive.  Reduced abduction due to pain.  X-rays show post repair changes but otherwise unremarkable.  MRI shoulder without and with IV contrast for further assessment.  ","Patient Profile: The patient is a 41-year-old male who is a badminton player. He has a history of right shoulder arthroscopic rotator cuff repair 2 years ago. He is now presenting with an 8-month history of right shoulder pain, which is limiting his ability to participate in competitions. His grip strength is okay and he has no night pain or fever. On examination, his impingement test is positive and he has reduced abduction due to pain. X-rays show post repair changes but are otherwise unremarkable.
Scan ordered:   MRI shoulder without and with IV contrast for further assessment",0.8022876273169194,0.7786052163533008,0.773941447103532,0.7654463125173198,0.7527806816431871,0.7746122569868519,0.7845927255371759,0.7792520711536093,0.7755581654827564,0.7750902365391793,0.7726080677116357,0.7774202532848713,0.7760162551358616
