,ACR scenario,Guideline,Variant,Appropriateness Category,MRI scan ordered,Clinical File,queries,Table_1,Table_2,Table_3,Table_4,Table_5,avg_table,Text_1,Text_2,Text_3,Text_4,Text_5,avg_text,avg_overall
51,"Confirmed stress (fatigue) fracture, excluding vertebrae. Follow-up imaging study for return-to-play evaluation.",ACR stress fracture including sacrum.pdf,5,UNA,MRI area of interest without and with IV contrast,"23 year old Malay male.  Professional soccer player.  Diagnosed with stress fracture of right tibia 3 months ago.  Now pain free for 2 weeks.  On examination, no tendereness at shin.  No deformity.  For MRI of right leg without and with IV contrast to assess suitability to return to play.","Patient Profile: The patient is a 23-year-old male professional soccer player. He was diagnosed with a stress fracture of the right tibia 3 months ago. He has been pain-free for 2 weeks. Upon examination, there is no tenderness at the shin and no deformity.
Scan ordered:   For MRI of right leg without and with IV contrast to assess suitability to return to play",0.738754243004544,0.7229821319903992,0.7200051571076457,0.7153374760883596,0.7139660448878499,0.7222090106157597,0.7592126148466026,0.7466773197146725,0.7395727743687519,0.73130568755102,0.7264801373602097,0.7406497067682514,0.7314293586920055
52,Suspected osteomyelitis of the foot in patients with diabetes mellitus. Initial imaging,ACR suspected OM foot in DM.pdf,1,UNA,MRI foot without and with IV contrast,"69 year old Chinese male.  Past medical history of diabetes, hypertension, hyperlipidemia, peripheral vascular disease post multiple balloon angioplasties, chronic renal disease.  Now presenting with left foot swelling and redness for 2 weeks, painful to walk.  On examination, left foot swelling, erythema, no crepitus.  No prior imaging.  For MRI of the left foot without and with IV contrast to assess for cellulitis and osteomyelitis. ","Patient Profile: The patient is a 69 year old male with a past medical history of diabetes, hypertension, hyperlipidemia, peripheral vascular disease post multiple balloon angioplasties, and chronic renal disease. He is currently presenting with left foot swelling and redness for 2 weeks, and it is painful for him to walk. There has been no prior imaging.
Scan ordered:   For MRI of the left foot without and with IV contrast to assess for cellulitis and osteomyelitis",0.7604748807789999,0.7601356134767113,0.7277787726853756,0.7225804214990912,0.7160315737091977,0.7374002524298751,0.7361109234066133,0.7277383140842221,0.722734280878901,0.7175034333413598,0.7150537236580036,0.7238281350738199,0.7306141937518476
53,Age greater than or equal to 16 years. Suspected acute cervical spine blunt trauma. Imaging indicated by NEXUS or CCR clinical criteria. Initial imaging,ACR suspected spine trauma.pdf,2,UNA,MRI cervical spine without IV contrast,"30 year old Caucasian male.  No prior medical history.  Now coming into emergency room for road traffic accident due to drink driving.  On examination, patient is intoxicated and in cervical collar.  Chest and pelvic compression positive.  Ecchymosis over abdomen in seat-belt injury.  No prior imaging.  For MRI cervical spine without IV contrast to assess for spine fracture and cord injury.  ","Patient Profile: The patient is a 30 year old Caucasian male with no prior medical history. He has been involved in a road traffic accident due to drink driving. He is currently intoxicated and in a cervical collar. He has positive chest and pelvic compression and ecchymosis over the abdomen due to a seat-belt injury. There has been no prior imaging.
Scan ordered:   For MRI cervical spine without IV contrast to assess for spine fracture and cord injury",0.7769287766405878,0.765684673969276,0.7579705848625319,0.7567658224379998,0.7533140893636887,0.7621327894548168,0.7738621328954779,0.7724406472737487,0.7668864056659708,0.7662909682863515,0.7659533230751784,0.7690866954393454,0.7656097424470811
54,Age greater than or equal to 16 years. Acute thoracic or lumbar spine injury detected on radiographs or noncontrast CT. Neurologic abnormalities. Next imaging study.,ACR suspected spine trauma.pdf,0,UA,MRI thoracic and lumbar spine without IV contrast ,"41 year old Chinese male.  No prior medical history.  Smoker.  Now coming into emergency room for road traffic accident. Patient was driving company car when rear-ended by a truck.  Car hit road divider.  On examintion, patient is alert, but power in bilateral lower limbs is 2 out of 5.  Slightly lax anal tone on digital rectal examination.  X-rays show T12 chance fracture.  MRI thoracic and lumbar spine without IV contrast to assess for neurologic injury.  ","Patient Profile: The patient is a 41-year-old male with no prior medical history. He was involved in a road traffic accident and is now presenting with reduced power in both lower limbs and a slightly lax anal tone. X-rays have revealed a T12 chance fracture. This is the initial imaging stage.
Scan ordered:   MRI thoracic and lumbar spine without IV contrast to assess for neurologic injury",0.771334150674681,0.7513792572131545,0.7322787253512584,0.731470291594738,0.7263329427191032,0.7425590735105871,0.7808335648862814,0.7749205285070426,0.7716901746353421,0.7660868724742128,0.7642978380232355,0.771565795705223,0.7570624346079051
55,Acute low back pain with or without radiculopathy. No red flags. No prior management. Initial imaging.,ACR low back pain.pdf,1,UNA,MRI lumbar spine with IV contrast,"48 year old Indian male.  CEO of shipping company.  Recreational cricket player.  Prior history of fatty liver, hyperlipidemia on statins.   Now presenting with low back pain for 3 days post cricket match.  No radiation to groin or lower limbs.  Able to walk.  Urination and bowel motion are ok.  No fever.  On examination, straight leg raise test is positive.  Power in bilateral lower limbs is full.  Digital rectal examination shows good anal tone.  No prior imaging.  For MRI lumbar spine with IV contrast to assess for prolapsed intervertebral disc or muscle strain. ","Patient Profile: The patient is a 48-year-old male with a history of fatty liver and hyperlipidemia. He is currently experiencing low back pain for 3 days after a cricket match. There is no radiation to the groin or lower limbs, and he is able to walk. Urination and bowel motion are normal, and there is no fever. On examination, the straight leg raise test is positive. Power in bilateral lower limbs is full. There has been no prior imaging.
Scan ordered:   For MRI lumbar spine with IV contrast to assess for prolapsed intervertebral disc or muscle strain",0.713812500457368,0.7112607745899068,0.7109393622714412,0.7107908529026393,0.7026478345809464,0.7098902649604604,0.7333723554733057,0.7305367424379079,0.7304460472013767,0.7293078725427772,0.7249305129532111,0.7297187061217156,0.719804485541088
56,"Low back pain with or without radiculopathy. One or more of the following: low-velocity trauma, osteoporosis, elderly individual, or chronic steroid use. Initial imaging.",ACR low back pain.pdf,6,UA,MRI lumbar spine without IV contrast,"73 year old Malay female.  Past history of cholecystectomy, fatty liver, obesity, hypertension, hyperlipidemia, osteoarthritis of bilateral knees post bilateral total knee replacement.  Now presenting with low back pain for 6 days.  No radiation to groin or lower limbs.  No difficulty passing urine or bowel motion.  On examination, mild step deformity at L2 region.  Power full in bilateral lower limbs.  Good anal tone on digital rectal examination.  No prior imaging.  For MIR lumbar spine without IV contrast to further assess low back pain.","Patient Profile: The patient is a 73 year old female with a past history of osteoarthritis of bilateral knees post bilateral total knee replacement. She is now presenting with low back pain for 6 days. There is a mild step deformity at L2 region on examination. There has been no prior imaging.
Scan ordered:   For MIR lumbar spine without IV contrast to further assess low back pain",0.7576542688053992,0.7520924453242267,0.7456645294111165,0.7447035406233062,0.7351192349445067,0.747046803821711,0.743639766001572,0.742392837394786,0.7403770020059877,0.7369222796204554,0.7367211132434152,0.7400105996532432,0.7435287017374771
57,Acute onset myelopathy. Initial imaging,ACR myelopathy.pdf,1,UA,MRI spine area of interest without and with IV contrast,"46 year old Caucasian female.  History of systemic lupus erythematosus on follow up with rheumatology.  Now presenting with 5 day history of worsening numbness and tingling in all 4 limbs, feels uncoordinated and more difficult to control continence.  On examination, reduced pinprick sensation in bilateral hands and feets, power in all 4 limbs is 3 to 4 out of 5.  Anal tone is equivocally lax.  No sensory level.  No prior imaging. For MRI whole spine without and with IV contrast to assess for myelopathy.","Patient Profile: The patient is a 46 year old Caucasian female with a history of systemic lupus erythematosus. She is currently experiencing worsening numbness and tingling in all 4 limbs, uncoordination, and difficulty controlling continence. On examination, she has reduced pinprick sensation in both hands and feet, power in all 4 limbs is 3 to 4 out of 5, and anal tone is equivocally lax. There is no sensory level. This is the initial imaging stage as there is no prior imaging.
Scan ordered:  For MRI whole spine without and with IV contrast to assess for myelopathy",0.7035657094789476,0.7032100129236601,0.7015113389281331,0.7002940243293425,0.6947487215860578,0.7006659614492282,0.7345338603334967,0.7332283591142351,0.7308141228909433,0.7273934218661298,0.7225155407386107,0.729697060988683,0.7151815112189557
58,"Suspected spine infection (such as epidural abscess or discitis osteomyelitis), with new or worsening back or neck pain, with or without fever, who may have one or more of the following red flags (diabetes mellitus, IV drug use, cancer, HIV, or dialysis) or abnormal lab values. Initial imaging.",ACR suspected spine infection.pdf,1,UA,MRI spine area of interest without and with IV contrast,"73 year old Indian male, with history of end stage diabetic nephropathy on haemodialysis. Complains of lower back pain for the past 2 months with occasional night pain. Associated with radicular pain of left lower limb. no fever. Physical exam reveals mild tenderness at L3-L4 region but otherwise unremarkable. No prior imaging. MRI lumbar spine without and with IV contrast for possible spondylodiscitis.","Patient Profile: The patient is a 73 year old male with a history of end stage diabetic nephropathy on haemodialysis. He has been experiencing lower back pain for the past 2 months, with occasional night pain. He also has radicular pain in his left lower limb. There is mild tenderness at the L3-L4 region. There is no prior imaging.
Scan ordered:  MRI lumbar spine without and with IV contrast for possible spondylodiscitis",0.7654709973278547,0.7590892911456935,0.7572051876519286,0.7553319825786279,0.7502671559961032,0.7574729229400415,0.7569731150839955,0.7531010038697187,0.7474306869963246,0.7473876748801311,0.7469703119663558,0.7503725585593051,0.7539227407496734
59,New or increasing nontraumatic cervical or neck pain. No red flags. Initial imaging,ACR cervical neck pain radiculopathy.pdf,1,UNA,MRI cervical spine with IV contrast,"70 year old malay male. History of diabetes, hyperlipidemia and hypertension. Worsening neck pain for past 6 months, no radiculopathy or night pain. No recent trauma. Clinical exam reveals mild midline tenderness over the cervical spine with limited range of motion, but no focal neurological deficit. MRI cervical spine without IV contrast for initial examination. ","Patient Profile: The patient is a 70 year old male with a history of diabetes, hyperlipidemia and hypertension. He has been experiencing worsening neck pain for the past 6 months, with no radiculopathy or night pain. There is no history of recent trauma. Clinical examination reveals mild midline tenderness over the cervical spine with limited range of motion, but no focal neurological deficit.
Scan ordered:  MRI cervical spine without IV contrast for initial examination",0.796160360203355,0.7853890877186396,0.7828658299453918,0.782423163588056,0.7819870049087169,0.7857650892728318,0.7931524478048081,0.7887819816959749,0.7877167172419229,0.7869942879117247,0.7833640866490275,0.7880019042606916,0.7868834967667617
60,Suspected osteomyelitis or septic arthritis or soft tissue infection (excluding spine and diabetic foot). Initial imaging.,ACR suspected OM septic arthritis soft tissue infection.pdf,1,UNA,MRI area of interest without and with IV contrast,"60 year old Chinese female. No past medical history.  Left wrist swelling and redness for 1 week. No trauma.  No fever. On examination, left wrist is warm swollen and tender.  No prior imaging. MRI of the left wrist without and with IV contrasts for possible septic arthritis.","Patient Profile: The patient is a 60 year old female with symptoms of left wrist swelling, redness, and tenderness for 1 week. There is no history of trauma or fever. The patient has not had any prior imaging.
Scan ordered:  MRI of the left wrist without and with IV contrasts for possible septic arthritis",0.7677166040742502,0.7616828461663835,0.7508745416638891,0.7489650587891687,0.7466691752642293,0.7551816451915843,0.7811717658005843,0.7730846585965478,0.7696060002338598,0.7675369276430852,0.7592383640116276,0.7701275432571408,0.7626545942243625
61,Clinically suspected osteonecrosis. Normal radiographs or radiographs that show findings suspicious for osteonecrosis.  Next imaging study.,ACR osteonecrosis.pdf,2,ICI,MRI area of interest without and with IV contrast,48 year old Caucasian male.  MRI right foot without and with IV contrast for ?osteonecrosis of navicular.  ,"Patient Profile: 48 year old Caucasian male
Scan ordered:   MRI right foot without and with IV contrast for ?osteonecrosis of navicular",0.7153071040850946,0.705277154603616,0.7045980039220553,0.7037974248884901,0.7023836802767912,0.7062726735552094,0.7647611659957531,0.7482162547352493,0.7460611293084977,0.7439978602430453,0.7409345505101331,0.7487941921585357,0.7275334328568726
62,"Adult or child 5 years of age or older. Fall or acute twisting trauma to the knee. No focal tenderness, no effusion, able to walk. Initial imaging.",ACR acute trauma to knee.pdf,1,ICI,MRI knee without IV contrast,8 year old Indian male.  MRI left knee without IV contrast for trauma.,"Patient Profile: The patient is an 8 year old Indian male. No symptoms, previous diagnosis, stage of diagnosis, or suspected conditions are provided in the profile.
Scan ordered:   MRI left knee without IV contrast for trauma",0.7754050309861508,0.7501915909129496,0.7414936458909153,0.7411935684306566,0.7405019884546042,0.7497571649350553,0.7768105369029271,0.7555969036302038,0.7501233143628124,0.7464799196968317,0.7447196930052418,0.7547460735196033,0.7522516192273293
63,Adult or child 5 years of age or older. Fall or acute twisting trauma to the knee. Tibial plateau fracture on radiographs. Suspect additional bone or soft-tissue injury. Next study.,ACR acute trauma to knee.pdf,5,ICI,MRI knee without IV contrast,19 year old Chinese male. MRI right knee without IV contrast for proximal tibia fracture.,"Patient Profile: The patient is a 19 year old Chinese male. No symptoms, previous diagnosis, stage of diagnosis, or suspected conditions are provided in the profile.
Scan ordered:  MRI right knee without IV contrast for proximal tibia fracture",0.7417922531244543,0.7340056498549482,0.7322417542788441,0.7291059165201699,0.7290565248892295,0.733240419733529,0.7583178425001633,0.7475200157668273,0.7431344846272872,0.7393327429065486,0.7365505568240184,0.7449711285249689,0.739105774129249
64,Superficial soft tissue mass. Initial imaging,ACR soft tissue mass.pdf,1,ICI,MRI area of interest without and with IV contrast,31 year old Malay female.  MRI left forearm without and with IV contrast for lump.,"Patient Profile: The patient is a 31 year old Malay female. No symptoms, previous diagnosis, stage of diagnosis, or suspected conditions are provided in the profile.
Scan ordered:   MRI left forearm without and with IV contrast for lump",0.6998374682659791,0.6959604803333468,0.6949137320403953,0.6942080733858795,0.6875865693766388,0.6945012646804478,0.7233607171281784,0.7178089797565662,0.7085097006175373,0.7055954525099745,0.7054435808451738,0.712143686171486,0.7033224754259669
65,New symptomatic VCF identified on radiographs. History of malignancy. Next imaging study.,ACR management of vertebral compression fracture.pdf,2,ICI,MRi spine area of interest without and with IV contrast,55 year old Chinese female.  MRI thoracic and lumbar spine without and with IV contrast for ?pathological vertebral compression fracture.,"Patient Profile: The patient is a 55 year old Chinese female. No symptoms, previous diagnosis, stage of diagnosis, or suspected conditions are provided in the profile.
Scan ordered:   MRI thoracic and lumbar spine without and with IV contrast for ?pathological vertebral compression fracture",0.7636219096635134,0.7624741312139257,0.7586005044542051,0.7567105831482779,0.7506730170269162,0.7584160291013677,0.7704571685253276,0.7689899095326747,0.7664126296164918,0.7641824541427186,0.7639780811299031,0.7668040485894231,0.7626100388453954
66,Inflammatory back pain. Suspected axial spondyloarthritis. Negative radiographs and negative MRI of the sacroiliac joints. Next imaging study.,ACR inflammatory back pain.pdf,3,ICI,MRi spine area of interest without and with IV contrast,34 year old Indian male.  MRI lumbosacral spine without and with IV contrast for ?ankylosing spondylitis.,"Patient Profile: 34 year old Indian male
Scan ordered:   MRI lumbosacral spine without and with IV contrast for ?ankylosing spondylitis",0.7474627880172574,0.7466747916868428,0.7441560178618474,0.7410009471177033,0.7380431445766927,0.7434675378520686,0.7727939520240739,0.7702927823481693,0.7678606226503457,0.7626610684473489,0.7614492544391188,0.7670115359818113,0.75523953691694
67,Traumatic shoulder pain. Radiographs show Bankart or Hill-Sachs lesion. Next imaging study.,ACR shoulder pain traumatic.pdf,5,ICI,MRI shoulder without IV contrast,24 year old Indian female.  MRI left shoulder without IV contrast for ?Hill Sachs lesion.  ,"Patient Profile: The patient is a 24 year old Indian female. No symptoms, previous diagnosis, stage of diagnosis, or suspected conditions are provided in the profile.
Scan ordered:   MRI left shoulder without IV contrast for ?Hill Sachs lesion",0.74058625442641,0.7221109050322007,0.709703668196128,0.7073282547319495,0.7056167756126753,0.7170691715998727,0.7461402210987927,0.7297736950833629,0.7276925315402931,0.7254923424641506,0.7239763040364,0.7306150188445999,0.7238420952222363
68,Traumatic shoulder pain. Radiographs normal. Physical examination and history consistent with dislocation event or instability. Next imaging study.,ACR shoulder pain traumatic.pdf,6,ICI,MRI arthrography shoulder,22 year old Malay male.  MRI right shoulder arthrography for ?dislocation.,"Patient Profile: The patient is a 22 year old Malay male. No symptoms, previous diagnosis, stage of diagnosis, or suspected conditions are provided in the profile.
Scan ordered:   MRI right shoulder arthrography for ?dislocation",0.7566526793016287,0.7527202752619387,0.746601455791785,0.7431657570377532,0.7430010726064099,0.7484282479999032,0.7748614236809218,0.7542251497452273,0.7409729071906076,0.7397671573260108,0.7376213978056891,0.7494896071496914,0.7489589275747972
69,Acute wrist fracture on radiographs. Suspect wrist tendon or ligament trauma. Next imaging study.,ACR acute hand and wrist trauma.pdf,3,ICI,MRI wrist without IV contrast,28 year old Bangladeshi male.  MRI left wrist for ?tendon injury.,"Patient Profile: The patient is a 28 year old male.
Scan ordered:   MRI left wrist for ?tendon injury",0.7438099467819369,0.7375729272566185,0.730724307863217,0.7298835137987227,0.7298230668719894,0.7343627525144969,0.7331094943707418,0.7304014656732877,0.729145855607151,0.7278680650115614,0.7247413892417486,0.729053253980898,0.7317080032476975
70,Soft-tissue swelling without ulcer. Suspected osteomyelitis or early neuropathic arthropathy changes of the foot in patients with diabetes mellitus. Additional imaging following radiographs.,ACR suspected OM foot in DM.pdf,2,ICI,MRI foot without and with IV contrast,58 year old Chinese male.  MRI right foot for ?Charcot foot.,"Patient Profile: The patient is a 58 year old Chinese male. No symptoms, previous diagnosis, stage of diagnosis, or suspected conditions are provided in the profile.
Scan ordered:   MRI right foot for ?Charcot foot",0.7485976353551447,0.7247088835110581,0.7228438158072166,0.7227721261739222,0.7216312845279704,0.7281107490750625,0.7316352744745992,0.7236886644715869,0.7220747943985422,0.7218057000932723,0.7123223750039576,0.7223053616883915,0.7252080553817271
